{"receiptVersion":"0.1","producer":"ARWP Resolver","target":"https://dkharlanau.github.io/agent-ready-web-profile/","canonicalUrl":"https://dkharlanau.github.io/agent-ready-web-profile/","observedAt":"2026-09-05T21:29:13.000Z","toolVersion":"0.2.0","resolverVersion":"0.1","decisionPolicyVersion":"0.1","identity":{"name":"Agent-Ready Web Profile","description":"Public agentic-web interoperability resolver, profile contract, directory and evidence tooling for discovering, normalizing and routing a website's real web, data, retrieval, agent and trust interfaces.","canonicalUrl":"https://dkharlanau.github.io/agent-ready-web-profile/"},"evidenceSummary":{"sourcesAttempted":10,"sourcesResolved":3,"interfacesResolved":34,"conflicts":0},"sources":[{"id":"http-head:0","type":"http-head","url":"https://dkharlanau.github.io/agent-ready-web-profile/","status":"resolved","authority":"observed-web","contentType":"text/html; charset=utf-8"},{"id":"arwp-profile:0","type":"arwp-profile","url":"https://dkharlanau.github.io/agent-ready-web-profile/ai/site-profile.json","status":"resolved","authority":"project-profile","contentType":"application/json; charset=utf-8"},{"id":"agent-skills-index:0","type":"agent-skills-index","url":"https://dkharlanau.github.io/.well-known/agent-skills/index.json","status":"resolved","authority":"upstream-convention","contentType":"application/json; charset=utf-8"},{"id":"a2a-agent-card:0","type":"a2a-agent-card","url":"https://dkharlanau.github.io/.well-known/agent-card.json","status":"not-found","httpStatus":404},{"id":"agents-json:0","type":"agents-json","url":"https://dkharlanau.github.io/agents.json","status":"not-found","httpStatus":404},{"id":"agents-txt:0","type":"agents-txt","url":"https://dkharlanau.github.io/agents.txt","status":"not-found","httpStatus":404},{"id":"api-catalog:0","type":"api-catalog","url":"https://dkharlanau.github.io/.well-known/api-catalog","status":"not-found","httpStatus":404},{"id":"ard-catalog-legacy:0","type":"ard-catalog-legacy","url":"https://dkharlanau.github.io/.well-known/ai-catalog.json","status":"not-found","httpStatus":404},{"id":"ard-catalog:0","type":"ard-catalog","url":"https://dkharlanau.github.io/.well-known/ard.json","status":"not-found","httpStatus":404},{"id":"oauth-protected-resource:0","type":"oauth-protected-resource","url":"https://dkharlanau.github.io/.well-known/oauth-protected-resource","status":"not-found","httpStatus":404}],"plans":{"read":{"intent":"read","outcome":"selected","selected":{"url":"https://dkharlanau.github.io/agent-ready-web-profile/llms.txt","protocol":"llms.txt","kind":"llms","sourceId":"homepage-scan","sourceAuthority":"observed-web","discoveryScope":"target-observed","score":101,"eligible":true},"fallbacks":[{"url":"https://dkharlanau.github.io/agent-ready-web-profile/directory.json","kind":"catalog","sourceId":"arwp-profile:0","sourceAuthority":"project-profile","discoveryScope":"unspecified","score":58,"eligible":true},{"url":"https://dkharlanau.github.io/agent-ready-web-profile/directory.json","kind":"catalog","name":"ARWP public site directory","description":"Initial directory of public websites that publish ARWP profiles.","mediaType":"application/json","sourceId":"arwp-profile:0","sourceAuthority":"project-profile","discoveryScope":"unspecified","score":58,"eligible":true},{"url":"https://dkharlanau.github.io/agent-ready-web-profile/","protocol":"HTML","kind":"html","mediaType":"text/html; charset=utf-8","sourceId":"http-head:0","sourceAuthority":"observed-web","discoveryScope":"target-observed","score":51,"eligible":true}],"rejected":[],"reason":"Selected llms from observed-web evidence after eligibility checks."},"search":{"intent":"search","outcome":"none","selected":null,"fallbacks":[],"rejected":[],"reason":"No suitable search interface was resolved."},"structured":{"intent":"structured","outcome":"selected","selected":{"url":"https://raw.githubusercontent.com/dkharlanau/agent-ready-web-profile/main/schema/site-profile.schema.json","kind":"schema","sourceId":"arwp-profile:0","sourceAuthority":"project-profile","discoveryScope":"unspecified","score":83,"eligible":true},"fallbacks":[],"rejected":[],"reason":"Selected schema from project-profile evidence after eligibility checks."},"tools":{"intent":"tools","outcome":"selected","selected":{"url":"https://github.com/dkharlanau/agent-ready-web-profile/tree/main/gateway","protocol":"MCP","kind":"mcp","name":"io.github.dkharlanau/agent-ready-web-profile","transport":"stdio","sourceId":"arwp-profile:0","sourceAuthority":"project-profile","discoveryScope":"unspecified","readOnly":true,"score":98,"eligible":true},"fallbacks":[{"url":"https://github.com/dkharlanau/agent-ready-web-profile/tree/main/resolver","protocol":"MCP","kind":"mcp","name":"arwp-site-resolver","transport":"stdio","sourceId":"arwp-profile:0","sourceAuthority":"project-profile","discoveryScope":"unspecified","readOnly":true,"score":98,"eligible":true},{"url":"https://github.com/dkharlanau/agent-ready-web-profile/tree/main/router","protocol":"MCP","kind":"mcp","name":"arwp-federated-router","transport":"stdio","sourceId":"arwp-profile:0","sourceAuthority":"project-profile","discoveryScope":"unspecified","readOnly":true,"score":98,"eligible":true}],"rejected":[],"reason":"Selected mcp from project-profile evidence after eligibility checks."},"agent":{"intent":"agent","outcome":"none","selected":null,"fallbacks":[],"rejected":[],"reason":"No suitable agent interface was resolved."}},"conflicts":[],"metrics":{"resolverRequests":10,"resolverBytes":11945,"note":"Counts resolver discovery fetches after the bounded base-site scan; scanner requests are reported separately by scanner tooling."},"upstreamStatus":{"RFC8288 HTTP Link":"ietf-standard","RFC9727":"ietf-standard","RFC9728":"ietf-standard","ARD":"multivendor-open-draft","A2A":"upstream-standard","Agent Skills":"upstream-convention","agents.txt/json":"community-convention","MCP Server Card":"experimental-upstream"},"artifactDigests":[],"boundaries":{"receiptIsResolverObservation":true,"receiptIsPublisherManifest":false,"receiptIsTrustCertificate":false,"metadataGrantsAuthorization":false,"sourceBodyDigestsCaptured":false,"note":"receipt payload integrity is covered; source-body digests are not claimed unless future fetch instrumentation records them explicitly."},"digests":{"algorithm":"sha256","canonicalization":"ARWP canonical JSON v0.1: object keys sorted recursively; array order preserved; UTF-8 JSON without insignificant whitespace","payload":"sha256:12386fb8103d00b4c3eddd6197c715eb24146d9c862b29a074d4cad2f2a1da2e"},"receiptId":"urn:sha256:12386fb8103d00b4c3eddd6197c715eb24146d9c862b29a074d4cad2f2a1da2e"}
